{
  "id": "11111111-1111-1111-1111-111111111111",
  "workstreamId": "22222222-2222-2222-2222-222222222222",
  "sessionId": "33333333-3333-3333-3333-333333333333",
  "turnOrdinal": 1,
  "purpose": "user",
  "status": "completed",
  "stopReason": "end_turn",
  "firstWorkstreamSeq": 1,
  "latestWorkstreamSeq": 5,
  "usage": {
    "inputTokens": 120,
    "outputTokens": 340,
    "cachedReadTokens": 0,
    "cachedWriteTokens": 0,
    "thoughtTokens": 0,
    "totalTokens": 460
  },
  "startedAt": "2026-08-03T00:00:00Z",
  "endedAt": "2026-08-03T00:00:05Z"
}
